file,search_result
0733Nuwayri.NihayatArab.Shamela0010283-ara1.mARkdown, قال المولوى محيى الدين عبد الله بن عبد الظاهر فى السيرة الظاهرية ولعب السلطان فى ميدان دمشق فرأيت فى خدمته جماعة
0733Nuwayri.NihayatArab.Shamela0010283-ara1.mARkdown, قال القاضى عبد الله بن عبد الظاهر فى السيرة الظاهرية عن هذه الوقعة حسبها أملاه السلطان من لفظه لما
0733Nuwayri.NihayatArab.Shamela0010283-ara1.mARkdown, قال المولى محيى الدين عبد الله بن عبد الظاهر رحمه الله تعالى فى السيرة الظاهرية لما كان يوم عاشوراء من هذه السنة وجد ما
0733Nuwayri.NihayatArab.Shamela0010283-ara1.mARkdown, ذكر ورود كتاب متملك الحبشة قال القاضى محيى الدين عبد الله بن عبد الظاهر فى السيرة الظاهرية فى هذه السنة وصل كتاب متملك الحبشة إلى السلطان
0733Nuwayri.NihayatArab.Shamela0010283-ara1.mARkdown, قال القاضى محيى الدين عبد الله بن عبد الظاهر فى السيرة الظاهرية وأما البرواناه فأنه شمر الذيل وامتطى هربا أشهب الصبح
0733Nuwayri.NihayatArab.Shamela0010283-ara1.mARkdown, قال القاضى محيى الدين عبد الله بن عبد الظاهر فى السيرة الظاهرية ودخل السلطان دمشق فى خامس المحرم وقد رنح النصر
0733Nuwayri.NihayatArab.Shamela0010283-ara1.mARkdown, وقال الموفق إنه إنما سيره السلطان الملك المنصور فورثه السلطان الملك الناصر بالولاء الشرعى ودفع
0734IbnSayyidNas.CuyunAthar.Shamela0023653-ara1, قال ابن سعد والذي قال في السيرة أن عصيمة من بني أسد بن خزيمة وأنه حليف بني
0734IbnSayyidNas.Minah.AOCP2023090619-ara1, وقال له شعر في فتح مكة ولم يذكره والذي رأيت له في السيرة عن أبي إسحق في أشعار الفتح قال وقال قائل من
0734IbnSayyidNas.Minah.AOCP2023090619-ara1, يذكر سيره مع رسول الله في الهجرة وقصة الغار وأمر سراقة بن
0734IbnSayyidNas.NafhShadhi.Sham19Y0016599-ara1, قال أبو القاسم الراغب الجد قطع الأرض المستوية ومنه جد في سيره يجد جدا وكذلك جد في أمره وأجد صار ذا جد
0734IbnSayyidNas.NafhShadhi.Sham19Y0016599-ara1, وقال ابن السكيت المال الدثر بكسر الدال الكثير وفي السيرة الهشامية في خبر النجاشي دبر من ذهب بفتح الدال وكلاهما
0735DawudIbnMakhila.CuyunHaqaiq.LMN230208105400-ara1, وقال رضي الله عنه فرق بين المريد والعابد فالمريد سيره باطنه وظاهره تبع والعابد سيره ظاهره وباطنه تبع والعابد يؤقت أوراده والمريد يؤقت وارداته فما
0736IbnDawadari.KanzDurar.Sham19Y0018147-ara1.mARkdown, وقال الدولابي كان سمحا معطاءا أهوجا قبيح السيرة سفاكا للدماء ضعيف الرأي ورزق من الولد موسى من أم
0736IbnDawadari.KanzDurar.Sham19Y0018147-ara1.mARkdown, ذكر سيرة أحمد بن طولون ومولده ووفاته قال صاحب التاريخ المظفري طولون
0736IbnDawadari.KanzDurar.Sham19Y0018147-ara1.mARkdown, يقول أحمد بن طولون من أولاد الأتراك وأبوه طولون تركي قال ورأيت سيرة للإخشيد قديمة عليها خط الفرغاني يقول أحمد بن التج بعض
0736IbnDawadari.KanzDurar.Sham19Y0018147-ara1.mARkdown, ذكر الشيخ أبو القاسم علي بن منجب بن سليمان الكاتب في سيره أن ابن مقلة الوزير ذكر أن الحسين بن القاسم بن
0736IbnDawadari.KanzDurar.Sham19Y0018147-ara1.mARkdown, وذكر القاضى بهاء ابن شداد صاحب سيرة السلطان صلاح الدين رحمهما الله فى السيرة المذكورة أنه جاءت زلزلة عظيمة بحلب وأخربت كثيرا من البلاد
0736IbnDawadari.KanzDurar.Sham19Y0018147-ara1.mARkdown, وقال القاضى بهاء الدين بن شداد فى سيرة السلطان صلاح الدين أنه انفك من الأسر يوم الثلاثاء حادى
0736IbnDawadari.KanzDurar.Sham19Y0018147-ara1.mARkdown, ذكر بعض شئ من سيرة الإمام الناصر كان شهما أبى النفس حازما متيقظا ذارزانة ودهاء
0736IbnDawadari.KanzDurar.Sham19Y0018147-ara1.mARkdown, قال ابن واصل فى تاريخه فى سيرة الظاهر بأمر الله ولقد تباعد بينه وبين أبيه الناصر لدين
0736IbnDawadari.KanzDurar.Sham19Y0018147-ara1.mARkdown, قال المنشى فى تاريخهوهو مصنف سيرة السلطان علاء الدين وولده جلال الدين إن الذى ملكه السلطان
0736IbnDawadari.KanzDurar.Sham19Y0018147-ara1.mARkdown, ذكر ما نقله ابن شداد من دلك قال الصاحب شمس الدين بن شدادرحمه الله تعالىفى سيره الملك الظاهر وهو المسمى بالروض الزاهر فى سيرة الملك الظاهر
0736IbnDawadari.KanzDurar.Sham19Y0018147-ara1.mARkdown, قال ابن شداد صاحب السيره قال ابن عبد الظاهر انه كان اجتماع رسل السلطان الملك
0736IbnDawadari.KanzDurar.Sham19Y0018147-ara1.mARkdown, قال بن شداد صاحب السيره فراوا نواب التتار الثياب فاخدوها فوجدوا الكتب فيها فحملت الى
0739SafiDinHanbali.Marasid.Shamela0011484-ara1, قال وكذا ذكره ابن هشام فى السيرة وهى ثنية بين مكة والمدينة قيل هى ثنية جبل قديد
0741IbnYahyaAndalusiMalaqi.TamhidWaBayan.JK000803-ara1, قال عثمان بن عفان رض & الباب العاشر في ذكر سيرة عثمان وفضائله رض كان عثمان رض يكنى أبا عبد الله
0741KhazinBaghdadi.LubabTawil.Shamela0023628-ara1.completed, قال الأزهري الذي يوضع موضع الطاقة والأصل فيه أن البعير يذرع بيديه في سيره ذرعا على قدر سعة خطوه فإذا حمل عليه أكثر من
0742Mizzi.TahdhibKamal.Shamela0003722-ara1.mARkdown, يقول لعبيد الله أين تذهيب قال أذهب إلى وهب بن جرير أكتب السيرة يعني عن أبيه عن مجالد قال تكتب كذبا كثيرا لو
0742Mizzi.TahdhibKamal.Shamela0003722-ara1.mARkdown, وقال في الطبقات الكبير روى عن زائدة كتبه ومصنفه وروى عن أبي إسحاق الفزاري كتاب السيرة في دار الحرب ونزل بغداد وسمع منه أهلها وتوفي بها
0743SharafDinTibi.SharhMishkat.Sham19Y0122257-ara1, ويقول أما بعد إلى آخره و الهدى السيرة يقال هدى هدى زيد إذا سار سيرته من تهادت المرأة
0743SharafDinTibi.SharhMishkat.Sham19Y0122257-ara1, وقال أبو عبيدة معنقا منبسطا في سيره يعني في القيامة تو لا أرى هذا سديدا لأن قوله
0743SharafDinTibi.SharhMishkat.Sham19Y0122257-ara1, قال الشيخ التوربشتي والقاضي أي ترون منهم من حسن السيرة ما تعرفون وترون من سوء السريرة ما تنكرون أي تجهلونه
0744IbnCabdHadi.CuqudDurriyya.JK000363-ara1, وقال في سيرة نبينا محمد صلى الله عليه وسلم مع أعدائه ببدر وغيرها
0744IbnCabdHadi.TabaqatCulama.Sham19Y0001994-ara1, وقال هذه جمل يسيرة هي غيض من فيض سيره وأحواله ومن تأمل كلامه في تصانيفه وتصرفه في أماليه ونظره
0744IbnCabdHadi.TabaqatCulama.Sham19Y0001994-ara1, قال شيرويه الديلمي قدم علينا همذان وكان حافظا ثقة يحسن هذا الشأن حسن السيرة عارفا بالأسماء والنسب مفيدا للطلبة وقال السلفي كان رفيقنا محمود
0744IbnCabdHadi.TabaqatCulama.Sham19Y0001994-ara1, قال أبو سعد السمعاني ثقة حافظ دين خير حسن السيرة صحيح العقيدة على طريقة السلف تارك للتكلف كان ربما خرج
0744IbnCabdHadi.TabaqatCulama.Sham19Y0001994-ara1, ¬ قال السمعاني كان حسن السيرة جميل الطريقة دمث الأخلاق كثير الصدقة والصلاة دائم الذكر متوددا
0744IbnCabdHadi.TabaqatCulama.Sham19Y0001994-ara1, وقال لي ولدت سنة ست وسبعين وأربع مئة وقال السمعاني هو من أولاد المحدثين حسن السيرة مكرم للغرباء فقير قنوع صحب والدي مدة مقامه بأصبهان وسمع
0744IbnCabdHadi.TabaqatCulama.Sham19Y0001994-ara1, قال أبو سعد السمعاني حافظ متقن مقرئ فاضل حسن السيرة مرضي الطريقة عزيز النفس سخي بما يملكه مكرم للغرباء يعرف
0744IbnCabdHadi.TabaqatCulama.Sham19Y0001994-ara1, وقال كان ثقة حافظا صالحا قال ابن فرتون ¬ أفرد له بعض تلامذته سيرة ¬ فذكر أنه مات فجأة في سلخ ربيع الأول سنة سبع
0745AbuHayyanGharnati.TadhyilTashil.Sham19Y0017116-ara1, قال لا يقال ظل فلان شهره سائرا إلا أن يكون إنما كان سيره نهارا خاصة فناقض وهذا الذي ذهب إليه لكذة والمهاباذي والسيرافي
0745AbuHayyanGharnati.TadhyilTashil.Sham19Y0017116-ara1, وقال غيره يجوز ذلك إذا أردت به جمع سيره قال النحاس والأجود عند جميع البصريين النصب لما ذكرت أنه
0745AbuHayyanGharnati.TafsirBahrMuhit.Shamela0023591-ara1.completed, وقال مقاتل الحكمة الزبور وقيل العدل في السيرة وقيل الحكمة العلم والعمل به وقال الضحاك هي سلسلة كانت
0745AbuHayyanGharnati.TafsirBahrMuhit.Shamela0023591-ara1.completed, وقال عكرمة أيضا لا تسيروا بغير سيرة الإسلام وقال السدي وعكرمة أيضا هو نهي عن هذه الأمور
0745AbuHayyanGharnati.TafsirBahrMuhit.Shamela0023591-ara1.completed, قال الفراء تقول العرب بعير محسور إذا انقطع سيره وحسرت الدابة حتى انقطع سيرها ويقال حسير فعيل بمعنى مفعول
0745AbuHayyanGharnati.TafsirBahrMuhit.Shamela0023591-ara1.completed, قال القرطبي ويزاد إلى هذه الآي أول يس إلى فهم لا يبصرون ففي السيرة أن الرسول صلى الله عليه وسلم حين نام على فراشه
0745AbuHayyanGharnati.TafsirBahrMuhit.Shamela0023591-ara1.completed, قال ابن عطية وهذا ضعيف لم يقع في سيرة ولا في كتاب يعتمد عليه وذو الحليفة ليس في طريق
0745AbuHayyanGharnati.TafsirBahrMuhit.Shamela0023591-ara1.completed, وقال الشاعر فلا تغضبن من سيرة أنت سرتها فأول راض سيرة من يسيرها واختلفوا في إعراب سيرتها فقال الحوفي مفعول ثان
0745AbuHayyanGharnati.TafsirBahrMuhit.Shamela0023591-ara1.completed, وقال الزمخشري هما عطفا بيان كقولك سيرة أبي حفص عمر الفاروق بين بملك الناس ثم زيد بيانا
0745AbuHayyanGharnati.TafsirNahrMadd.Tafsir08090-ara1, قال ابن عباس أما السنون فكانت لباديتهم ومواشيهم وأما نقص الثمرات فكان في أمصارهم وهذه سيرة الله في الأمم يبتليها بالنقم ليزدجروا ويتذكروا بذلك ما كانوا
0748Dhahabi.CibarFiKhabar.Shamela0025841-ara1.mARkdown, وقال أدعو إلى سيرة عمر بن الخطاب فجاء مسلمة وحاربه ثم قتل في صفر
0748Dhahabi.CibarFiKhabar.Shamela0025841-ara1.mARkdown, قال عبد الرحمن بن زيد بن أسلم لما استخلف قال سيروا سيرة عمر ابن عبد العزيز فأتوه بأربعين شيخا شهدوا له أن
0748Dhahabi.CibarFiKhabar.Shamela0025841-ara1.mARkdown, قال الصولي كان القاهر أهوج سفاكا للدماء قبيح السيرة كثير الاستحالة مدمن الخمر كان له حربة يحملها فلا يضعها
0748Dhahabi.CibarFiKhabar.Shamela0025841-ara1.mARkdown, قال ابن السمعاني إمام بارع مبرز جامع لأنواع من العلوم الشرعية سديد السيرة مكثر مات يوم عيد الضحى سنة أربع وخمسين وخمس مائة
0748Dhahabi.DiwanDucafa.Shamela0096955-ara1.mARkdown, وقال ابن حبان لا يحتج به د س هارون بن أبي عيسى روى السيرة عن ابن إسحاق قال البخاري يخطئ عن غير ابن إسحاق
0748Dhahabi.MacrifaQurraKibar.JK000443-ara1.mARkdown, وقال الشعر وكان غير حميد السيرة مات في سنة ست عشرة وسبع مئة وهو في عشر
0748Dhahabi.ManaqibAbiHanifa.Shamela0010461BK1-ara1.mARkdown, وقال محمد بن حماد بن المبارك المصيصي في سيرة أبي حنيفة قال محمد بن مليح بن وكيع بن الجراح
0748Dhahabi.MizanIctidal.JK001293BK1-ara1.mARkdown, يقول لعبيدالله القواريري إلى أين تذهب قال إلى وهب بن جرير أكتب السيرة قال تكتب كذبا كثيرا قال أحمد بن حنبل هو حسن
0748Dhahabi.MizanIctidal.JK001293BK1-ara1.mARkdown, قال سار عمر إلى الشام بعد سيره الأول إليها حتى إذا شارفها بلغه أن الطاعون فيها فقال
0748Dhahabi.MucjamShuyukh.Shamela0012531-ara1.mARkdown, قال لي ولدت سنة أربع وستين وست مائة وسمعت السيرة من الأبرقوهي وغيره روى لنا عن قاضي القضاة ابن دقيق
0748Dhahabi.MughniFiDucafa.JK001307-ara1.mARkdown, قال الأزدي لا يحتج به ثعلب بن مذكور الاكاف عن ابن الحصين سييء السيرة بمره ثمامة بن عبيدة عن أبي الزبير قال أبو حاتم
0748Dhahabi.Muhadhdhab.Sham19Y0146127-ara1, قال بعد اليوم السيرة في أهل الكتاب قال تعالى {قاتلوا الذين لا يؤمنون بالله
0748Dhahabi.MukhtasarMinDubaythi.JK009161-ara1.mARkdown, وقال فيه الإمام أبو عمرو بن الصلاح ما رأيت مثله وجمع له الحافظ الضياء سيرة في جزءين في اشتغاله وعلمه وزهده ومناقبه وأحواله شفى فيها
0748Dhahabi.RisalaTuruqHadith.Masaha002199-ara1, وقال شمس الدين الدمشقي في السيرة الشامية ج ق في كلامه على حديث الغدير ورواته من
0748Dhahabi.SiyarAclamNubala.Shamela0010906-ara1.mARkdown, قال وهذا الذي اعتمده محمد بن إسحاق في السيرة وقد اختلف أصحاب ابن إسحاق عليه في بعض الأسماء قال
0748Dhahabi.SiyarAclamNubala.Shamela0010906-ara1.mARkdown, وقال شيخنا أبو محمد الدمياطي في السيرة من تأليفه عن أبي جعفر محمد بن علي قال ولد
0748Dhahabi.SiyarAclamNubala.Shamela0010906-ara1.mARkdown, قال أخبرني أبو داود سليمان بن موسى فذكره بمعناه وقال ابن إسحاق في السيرة إن أبا طالب خرج إلى الشام تاجرا في ركب ومعه
0748Dhahabi.SiyarAclamNubala.Shamela0010906-ara1.mARkdown, قال فكيف رأيتم سيرتي فيكم قالوا خير سيرة قال فما بالكم قالوا فارقت ديننا وزعمت أن عيسى عبد
0748Dhahabi.SiyarAclamNubala.Shamela0010906-ara1.mARkdown, وقال شيخنا الدمياطي في السيرة له كان سيما الملائكة يوم حنين عمائم حمرا قد أرخوها
0748Dhahabi.SiyarAclamNubala.Shamela0010906-ara1.mARkdown, ذكر هذه السرايا شيخنا الدمياطي في مختصر السيرة وأظنه أخذه من كلام الواقدي وفي رجب صلى رسول الله
0748Dhahabi.SiyarAclamNubala.Shamela0010906-ara1.mARkdown, قال في نواحي جرجان وقد نبتت عليه كرمة وظللت وأثمرت فعجب الرجل وتذكر شعره سيرة ذي النورين عثمان رضي الله عنه عثمان بن عفان بن
0748Dhahabi.SiyarAclamNubala.Shamela0010906-ara1.mARkdown, قال اقدرها لي وفي سيرة ابن عباس أنه كان أميرا على البصرة لعلي وأن أبا
0748Dhahabi.SiyarAclamNubala.Shamela0010906-ara1.mARkdown, وقال أدعو إلى سيرة عمر بن الخطاب فحاربه مسلمة بن عبد الملك وقتله ثم
0748Dhahabi.SiyarAclamNubala.Shamela0010906-ara1.mARkdown, قال شباب أسلم عامة البربر في ولاية إسماعيل وكان حسن السيرة وقال أبو مسهر أدرك إسماعيل بن عبيد الله معاوية وهو
0748Dhahabi.SiyarAclamNubala.Shamela0010906-ara1.mARkdown, يقول لعبيد الله أين تذهب قال أذهب إلى وهب بن جرير أكتب السيرة يعني عن أبيه عن مجالد قال تكتب كذبا كثيرا لو
0748Dhahabi.SiyarAclamNubala.Shamela0010906-ara1.mARkdown, قال فما زال ابن شبرمة مختفيا حتى مات بخراسان سيره إليها عيسى بن موسى روى ابن فضيل عن أبيه قال
0748Dhahabi.SiyarAclamNubala.Shamela0010906-ara1.mARkdown, يقول لعبيد الله إلى أين تذهب قال أذهب إلى وهب بن جرير أكتب السيرة قال يكتب كذبا كثيرا قلت كان وهب يرويها عن أبيه
0748Dhahabi.SiyarAclamNubala.Shamela0010906-ara1.mARkdown, قال القاضي عياض في سيرة مالك قال ابن نافع وأشهب وأحدهما يزيد على الآخر قلت
0748Dhahabi.SiyarAclamNubala.Shamela0010906-ara1.mARkdown, قال محمد بن سعد يروي عن زائدة مصنفه ويروي عن أبي إسحاق الفزاري كتاب السيرة في دار الحرب نزل بغداد وسمع منه أهلها قال علي
0748Dhahabi.SiyarAclamNubala.Shamela0010906-ara1.mARkdown, قال أبو معشر المنجم كان أمارا بالعدل محمود السيرة ميمون النقيبة فقيه النفس يعد من كبار العلماء وروي عن
0748Dhahabi.SiyarAclamNubala.Shamela0010906-ara1.mARkdown, ويذكر أولا سيرة الصحابي مستوفاة ثم يذكر ما رواه ويوضح علل الأحاديث ويتكلم
0748Dhahabi.SiyarAclamNubala.Shamela0010906-ara1.mARkdown, قال البلخي لم يكن في نظراء ابن الراوندي مثله في المعقول وكان أول أمره حسن السيرة كثير الحياء ثم انسلخ من ذلك لأسباب وكان علمه فوق
0748Dhahabi.SiyarAclamNubala.Shamela0010906-ara1.mARkdown, قال الصولي كان أهوج سفاكا للدماء كثير التلون قبيح السيرة مدمن الخمر ولولا جودة حاجبه سلامة لأهلك الحرث والنسل وكان
0748Dhahabi.SiyarAclamNubala.Shamela0010906-ara1.mARkdown, قال وكان متصرفا في علم النحو والبلاغة والشعر وكان مجانبا للدولة لكنه ولي الحسبة فأحسن السيرة توفي في المحرم سنة اثنتين وثلاثين وثلاث مائة ابن قوهيار
0748Dhahabi.SiyarAclamNubala.Shamela0010906-ara1.mARkdown, وقال هذه جمل يسيرة هي غيض من فيض سيره وأحواله ومن تأمل كلامه في تصانيفه وتصرفه في أماليه ونظره
0748Dhahabi.SiyarAclamNubala.Shamela0010906-ara1.mARkdown, وقال أبو النضر محمد بن عبد الجبار العتبي في كتاب اليميني في سيرة هذا الملك قيل فيه تعالى الله ما شاء وزاد الله
0748Dhahabi.SiyarAclamNubala.Shamela0010906-ara1.mARkdown, قال السمعاني في الذيل كان مقرئا فاضلا كثير التصانيف حسن السيرة زاهدا متعبدا خشن العيش منفردا قانعا يقرئ ويسمع في أكثر
0748Dhahabi.SiyarAclamNubala.Shamela0010906-ara1.mARkdown, قال الحافظ عبد الغافر بن إسماعيل في تاريخه كان البيهقي على سيرة العلماء قانعا باليسير متجملا في زهده وورعه وقال أيضا هو
0748Dhahabi.SiyarAclamNubala.Shamela0010906-ara1.mARkdown, قال فاعتذرت فقال ما أطلقنا شيئا من أموالنا بل نحن خزانهم نعم وأحسن البساسيري السيرة ووصل الفقهاء ولم يتعصب للشيعة ورتب لأم الخليفة راتبا ثم
0748Dhahabi.SiyarAclamNubala.Shamela0010906-ara1.mARkdown, قال أبو سعيد السمعاني كان شيخا صالحا سديد السيرة حدث ب الصحيح وببعض جامع أبي عيسى عن أحمد بن
0748Dhahabi.SiyarAclamNubala.Shamela0010906-ara1.mARkdown, قال السمعاني كان حسن السيرة جميل الأمر صحيح السماع وقال الخطيب كتبت عنه وكان صدوقا
0748Dhahabi.SiyarAclamNubala.Shamela0010906-ara1.mARkdown, وقال أبو سعد الحافظ السمعاني كان صالحا عفيفا سديد السيرة روى عنه جدي في أماليه وتوفي في حدود السبعين وأربع
0748Dhahabi.SiyarAclamNubala.Shamela0010906-ara1.mARkdown, قال السمعاني شيخ ثقة صالح حسن السيرة مات في جمادى الأولى سنة اثنتين وأربعين وخمس مائة وله
0748Dhahabi.SiyarAclamNubala.Shamela0010906-ara1.mARkdown, قال إسماعيل بن محمد الحافظ كان حسن السيرة من أهل الفضل والعلم محتاطا في الأخذ ثقة وقال السمعاني
0748Dhahabi.SiyarAclamNubala.Shamela0010906-ara1.mARkdown, وقال السمعاني كان محمود السيرة في ولايته مشفقا على الرعية سمعت أن السلطان ملكشاه أراد
0748Dhahabi.SiyarAclamNubala.Shamela0010906-ara1.mARkdown, وقال له يا حسن رضي الله عنك كرضى أمير المؤمنين عنك وللنظام سيرة طويلة في تاريخ ابن النجار وكان شافعيا أشعريا وقيل إن
0748Dhahabi.SiyarAclamNubala.Shamela0010906-ara1.mARkdown, قال ابن عقيل بهر العقول سيرة النظام جودا وكرما وعدلا وإحياء لمعالم الدين كانت أيامه دولة
0748Dhahabi.SiyarAclamNubala.Shamela0010906-ara1.mARkdown, قال السمعاني شيخ مسن معمر حسن السيرة ذو نعمة وثروة حدثنا عنه عمي الحسن وأبو طاهر محمد
0748Dhahabi.SiyarAclamNubala.Shamela0010906-ara1.mARkdown, قال ابن ناصر كان صالحا ثقة وقال السمعاني شيخ جليل ثقة خير مرضي الطريقة حسن السيرة سافر الكثير ووصل إلى المغرب وقال ولده عبد الخالق حدثني
0748Dhahabi.SiyarAclamNubala.Shamela0010906-ara1.mARkdown, وقال كان أوحد أهل زمانه في علوم عدة وقد عمل السلفي له سيرة وطول وقال كان في زمانه درة وشاحه وغرة أوضاحه ومالك
0748Dhahabi.SiyarAclamNubala.Shamela0010906-ara1.mARkdown, قال السمعاني كان ثقة مأمونا حسن السيرة جميل الطريقة من أولاد المحدثين وقال عبد الغافر ثقة أمين
0748Dhahabi.SiyarAclamNubala.Shamela0010906-ara1.mARkdown, قال ابن النجار كان عسرا غير مرضي السيرة يخل بالصلوات ويرتكب المحظورات روى عنه ابن الإخوة والسلفي قال
0748Dhahabi.SiyarAclamNubala.Shamela0010906-ara1.mARkdown, قال أبو يعلى بن القلانسي كان الأفضل حسن الاعتقاد سنيا حميد السيرة كريم الأخلاق لم يأت الزمان بمثله قلت وصلب البطائحي المتولي
0748Dhahabi.SiyarAclamNubala.Shamela0010906-ara1.mARkdown, قال السمعاني كان سديد السيرة قرأ بروايات ونسخ أجزاء كثيرة وكان واسع الرواية موثوقا به
0748Dhahabi.SiyarAclamNubala.Shamela0010906-ara1.mARkdown, وقال ابن النجار تميز وصنف في الأصلين والخلاف والمذهب وكان دينا ثقة حميد السيرة رحمه الله ابن أبي جعفر عبد الله بن محمد بن
0748Dhahabi.SiyarAclamNubala.Shamela0010906-ara1.mARkdown, قال السمعاني كثير السماع حسن السيرة مليح المجالسة ما رأيت أخف روحا منه مع السخاء والبذل
