file,search_result
0902Sakhawi.JawahirWaDurar.Sham19Y0017372-ara1, قال ولأبي الحسن علي بن جابر بن علي الهاشمي قوم لهم سيرة سارت بجهلهم قد ارتدوا برداء الكبر والحمق وخفت رؤوسهم أو
0902Sakhawi.ManhalCadhb.JK010317-ara1, قال في تاريخه شيخ الإسلام العالم الرباني الزاهد إلى أن قال وله سيرة مفردة في علومه وتصانيفه ودينه وتفننه وورعه وزهده وقناعته وتعبده
0902Sakhawi.QawlBadic.Shamela0001391-ara1, قال وهذه كانت سيرة سلفنا الصالح وأئمتنا الماضين وكان مالك رضي الله عنه إذا
0902Sakhawi.SirrMaktum.Shamela0001500-ara1, قال وانظر سيرة نبينا صلى الله عليه وسلم وخلقه في المال تجده قد
0902Sakhawi.TuhfaLatifa.Masaha004395Vols-ara1.completed, وذكر قصته أيضا ابن اسحاق في السيرة عن بعض أهل المدينة قال لما أسلم الحجاج قال يا
0902Sakhawi.TuhfaLatifa.Masaha004395Vols-ara1.completed, وقال الخطيب إنه كان محمودا في ولايته جميل السيرة مع جلالة قدره وذكره الزبير بن بكار في النسب فقال
0905IbnCabdAllahWaqqadAzhari.SharhTasrih.Shamela0009985-ara1, يقول جملي في سرعة سيره كالظليم الذي له بيضات يسير ليلا ونهارا ليصل إليها والرائح
0909IbnMabrid.DurrNaqi.Sham19Y0131003-ara1, قال والطبيب أيضا ¬ والفحل الماهر بالضراب الذي يتعهد في سيره موطئ خفه قال والطب السحر والعادة والداء أيضا قال والطب
0909IbnMabrid.MahdSawab.Shamela0012062-ara1, وقال اخرج يا رسول الله وذكر أبو القاسم الأصفهاني في سيرة السلف بسند إلى أسامة ابن زيد بن أسلم عن أبيه
0909IbnMabrid.MahdSawab.Shamela0012062-ara1, وقال في عيون التاريخ وهو طريق ابن هشام في السيرة وغيره ثم أسلم عمر بن الخطاب وكان رجلا جلدا منيعا
0909IbnMabrid.MahdSawab.Shamela0012062-ara1, وذكر أبو القاسم الأصفهاني في سيرة السلف عن عمر رضي الله عنه وافقت ربي في ثلاث
0909IbnMabrid.MahdSawab.Shamela0012062-ara1, قال بل غسيل فقال البس جديدا وعش حميدا ومت شهيدا وروى أبو القاسم الأصفهاني في سيرة السلف بسنده عن عبد الله بن عمر رضي الله عنه
0909IbnMabrid.MahdSawab.Shamela0012062-ara1, ويقول إني رجل عربي ولست أستمرئ الزيت قال أسامة بن مرشد الذي اختصر سيرة عمر لابن الجوزي بعد هذا الحديث قلت من غير رد
0909IbnMabrid.MahdSawab.Shamela0012062-ara1, قال كنا مع عمر في مسير فأبصر رجلا يسرع في سيره فقال إن هذا الرجل يريدنا فأناخ ثم ذهب لحاجته فجاء
0909IbnMabrid.MahdSawab.Shamela0012062-ara1, وقال قال ابن وهب تفسير محدثون ملهمون وذكره أبو القاسم الأصفهاني في سيرة السلف عن عائشة رضي الله عنها قالت قال رسول الله
0909IbnMabrid.MahdSawab.Shamela0012062-ara1, وذكر أبو القاسم الأصفهاني في سيرة السلف عن ابن عباس قال لما طعن عمر دخلت عليه
0909IbnMabrid.MahdSawab.Shamela0012062-ara1, وذكر القاسم الأصفهاني في سيرة السلف عن ابن عمر قال كان رأس عمر رضي الله
0909IbnMabrid.MahdSawab.Shamela0012062-ara1, وذكر أبو القاسم الأصفهاني في سيرة السلف قال المهدي ما فتشت رافضيا قط إلا وجدته زنديقا
0909IbnMabrid.MaraqiJinan.ShamAY0033733-ara1, قال قال الحسين بن علي رضي الله عنهما سألت أبي عن سيرة النبي صلى الله عليه وسلم في جلسائه فقال كان رسول
0909IbnMabrid.MaraqiJinan.ShamAY0033733-ara1, قال الذهبي وغيره كان حسن السيرة جوادا كريما وكذلك أبوه المسترشد بالله كان من الأجواد ومنهم
0911Samhudi.WafaWafa.Shamela0023695-ara1.completed, ذكر من سيرة الفطيون في افتضاض الأبكار إنما كانت في غير الأوس والخزرج
0911Samhudi.WafaWafa.Shamela0023695-ara1.completed, ذكر أمر الخلافة وقال الأقشهري في روضته روى صاحب السيرة ولم يسمه أن جبريل عليه السلام أتى النبي صلى الله
0911Samhudi.WasailWusul.Masaha003032-ara1, قال القاضي عياض رحمه الله تعالى في الشفا انظر سيرة نبينا محمد صلى الله عليه وسلم وخلقه في المال تجده
0911Samhudi.WasailWusul.Masaha003032-ara1, قال الحافظ الكبير زين الدين العراقي رحمه الله تعالى في ألفية السيرة النبوية على صاحبها أفضل الصلاة والسلام ونعله الكريمة المصونه طوبى
0911Samhudi.WasailWusul.Masaha003032-ara1, قال قال الحسين سألت أبي عن سيرة النبي صلى الله عليه وسلم في جلسائه فقال كان رسول
0911Samhudi.wafa.ShamAY0038406-ara1, قال القاضي عياض عقب ذلك وهذه كانت سيرة سلفنا الصالح وأئمتنا الماضين وذكر ابن بشكوال أن مالكا كان
0911Samhudi.wafa.ShamAY0038406-ara1, وقال أنه الموافق لسيرة الصديق فيما خلفه صلى الله عليه وسلم انتهى وهذا يقتضي
0911Suyuti.BughyatWucat.Shamela0006744-ara1.mARkdown, قال عبد الغافر في السياق رجل فاضل سديد الطريقة مرضي السيرة قرأ على أبي الحسن الغزالي وأخذ عنه القراءة ومهر في
0911Suyuti.BughyatWucat.Shamela0006744-ara1.mARkdown, قال الخزرجي كان وحيد دهره في النحو واللغة والعروض عالما متقنا متفننا لوذعيا حسن السيرة سهل الأخلاق مبارك التدريس أخذ النحو عن جماعة وأخذ عنه
0911Suyuti.BughyatWucat.Shamela0006744-ara1.mARkdown, قال السمعاني من أهل هراة سكن بلخ وكان أديبا فاضلا عالما بأصول الفقه صائنا حسن السيرة قدم بغداد حاجا فاجتمع إليه أهل العلم وقرءوا عليه الحديث
0911Suyuti.DurrManthur.Shamela0012884-ara1.completed,} قال هو الطيور عصافة الزرع وأخرج ابن إسحق في السيرة والواقدي وابن مردويه وأبو نعيم والبيهقي عن عائشة قالت لقد
0911Suyuti.GhayatIhsan.Kraken210525140115-ara1, قال قبائل بالنص فى خلق الانسان لتابت انظر خلق الانسان لثابت والأصمعى والخصص / وكذا شرح السيرة لأنى فر احشني / ف ل السعوب تصحيف والعحب موصل قبائل
0911Suyuti.HusnMuhadara.Shamela0003283-ara1.completed, قال ابن كثير سمع الحديث وبرع في المذهب وولي قضاء الحنابلة بالقاهرة وكان مشكور السيرة مات في صفر سنة ست وتسعين وستمائة وله خمسون وستون
0911Suyuti.JamicKabir.Sham19Y0127677-ara1, قال إن هذه الإمارة التى ترى اليوم سيرة قد أوشكت أن تفشو وتكثر حتى ينالها من ليس لها
0911Suyuti.JamicKabir.Sham19Y0127677-ara1, ¬ / قال عبد الملك بن هشام فى السيرة حدثنى أبو بكر بن الزبير أن رجلا دخل على أبى
0911Suyuti.JamicKabir.Sham19Y0127677-ara1, قال تسعمائة وسبعين ناقة وثلاثين فرسا فى غزوة تبوك ابن شاهين في السيرة ¬ / حدثنى بعض أهل العلم أن الحسن بن أبى الحسن قال
0911Suyuti.LaaliMasnuca.JK005004-ara1, وقال الحافظ فتح الدين بن سيد الناس في السيرة قد روي أن عبد الله بن المطلب وآمنة بنت وهب
0911Suyuti.MufhimatAqran.JK009252-ara1, قال يقال له سيرة وعن عكرمة قال رجل من بني لبث وأخرج ابن جرير
0911Suyuti.Muhadarat.Shamela0009099-ara1, قال في السيرة المشهورة للشيخ العارف بالله اليمني المعروف بالصياد أنه رأى في
0911Suyuti.MuzhirFiCulumLugha.JK001460-ara1, يقول المختصرات التي فضلت على الأمهات أربعة مختصر العين للزبيدي ومختصر الزاهر للزجاجي ومختصر سيرة ابن إسحاق لابن هشام ومختصر الواضحة للفضل بن سلمة قال
0911Suyuti.MuzhirFiCulumLugha.JK001460-ara1, قال أيستقضى من ليست له بصيرة قال نعم إذا حسنت منه السيرة قال فإن تعرى من العقلقال ذاك عنوان الفضل قال فإن
0911Suyuti.MuzhirFiCulumLugha.JK001460-ara1, قال الفراء أخبرني معاذ الهراء قال لقد قيل سيرة العمرين قبل عمر بن عبد العزيز والأقرعان الأقرع بن حابس
0911Suyuti.RafcBas.ShamAY0035870-ara1, وقال ابن الجوزي كان فيه لطف وظرف جمع سيرة المسترشد وسيرة المقتفي وقال الذهبي كان يلقب بهاء الشرف وروى
0911Suyuti.SawnMantiq.Sham19Y0151019-ara1, وقال الأوزاعي المنازعة والجدال في الدين محدث ثم قال وعلم أنك متى تدبرت سيرة الصحابة ومن بعدهم من السلف الصالح وجدتهم ينهون عن جدال
0911Suyuti.SharhShawahidMughni.Sham19Y0017724-ara1, يقول أين المفر والإله الطالب والأشرم المغلوب ليس الغالب وأخرجه ابن هشام في السيرة نحوه قال نفيل بن حبيب فذكر البيت بلفظ ليس الغالب
0911Suyuti.TabaqatHuffaz.JK000753-ara1.mARkdown, قال السمعاني حافظ كبير تام المعرفة ثقة دين حسن السيرة على طريقة السلف يحفظ جميع صحيح مسلم وأملى من حفظه
0911Suyuti.TabaqatMufassirin.Shamela0006234-ara1.completed, قال عبد الغافر كان إماما كاملا في التفسير حسن السيرة في التصوف على حظ تام من معرفة العربية والحديث والتواريخ
0911Suyuti.TarikhKhulafa.Shamela0011997-ara1.completed, وقال ابن إسحاق في السيرة حدثني الزهري قال حدثني أنس بن مالك قال لما بويع
0911Suyuti.TarikhKhulafa.Shamela0011997-ara1.completed, وقال الصولي كان أهوج سفاكا للدماء قبيح السيرة كثير التلون والاستحالة مدمن الخمر ولولا جودة حاجبه سلامة لأهلك
0911Suyuti.TarikhKhulafa.Shamela0011997-ara1.completed, قال وكان مع ذلك رديء السيرة في الرعية مائلا إلى الظلف والعسف ففارق أهل البلاد بلادهم
0911Suyuti.TarikhKhulafa.Shamela0011997-ara1.completed, وقال ابن الأثير كان الناصر سيئ السيرة خربت في أيامه العراق مما أحدثه من الرسوم وأخذ أموالهم
0911Suyuti.TarikhKhulafa.Shamela0011997-ara1.completed, وقال الموفق عبد اللطيف بويع أبو جعفر فسار السيرة الجميلة وعمر طرق المعروف الدائرة وأقام شاعر الدين ومنار الإسلام
0911Suyuti.TarikhKhulafa.Shamela0011997-ara1.completed, قال ابن حجر راجع الناس السلطان في أمر إبراهيم هذا ووسموه بسوء السيرة فلم يلتفت إلى ذلك ولم يزل الناس حتى بايعوه وكان
0911Suyuti.ZiyadatCalaMawducat.Sham19Y0018315-ara1, قال قال رسول الله صلى الله عليه وسلم الرزق يأتي العبد في أي سيرة سار لا تقوى متق بزائده ولا فجور فاجر ¬ بناقصه بينه
0914IbnYahyaWansharisi.Micyar.ShamAY0034230-ara1, قال أبو حامد الغزالي رحمه الله كانت سيرة العلماء مع الأمراء قلة المبالاة وإخلاص النصيحة لهم لأنهم اتكلوا
0914IbnYahyaWansharisi.Micyar.ShamAY0034230-ara1, تذكر كل ما عليه من دين حسبما يجب في السيرة وهو قد ألقى بيده واعترف بعجزه وفي المسالة من الخلاف
0916IbnFanad.MaathirAbrar.Zaydiyya0000090BK1-ara1.completed, قال الحاكم وله وقائع كثيرة ولكنه أساء السيرة وحكي عنه أشياء منكرة اتفقوا على سقوط عدالته وأنه ليس
0916IbnFanad.MaathirAbrar.Zaydiyya0000090BK1-ara1.completed, ذكر السيد صارم الدين أنه ولده ولعلهما اتفقا في السيرة والمثل والله أعلم أخبار الإمام المرتضى بن الهادي عليهما السلام
0916IbnFanad.MaathirAbrar.Zaydiyya0000090BK1-ara1.completed, قال مصنف سيرة الناصر كنت أتصل بالإمام المرتضى وأتكلم بما أحب بين يديه
0916IbnFanad.MaathirAbrar.Zaydiyya0000090BK1-ara1.completed, قال مصنف سيرة الناصر ولما قدم عليه السلام من الحجاز في آخر ذي
0916IbnFanad.MaathirAbrar.Zaydiyya0000090BK1-ara1.completed, قال مصنف سيرة الناصر عليه السلام ولقد رأيت من سمعه من العسكر اهتزوا
0916IbnFanad.MaathirAbrar.Zaydiyya0000090BK1-ara1.completed, قال مصنف سيرة الناصر عليه السلام وفتتت هذه الوقعة أعضاد الملحدين قال ولقد
0916IbnFanad.MaathirAbrar.Zaydiyya0000090BK1-ara1.completed, قال مسلم اللحجي فهذه الأخبار توجد في سيرة الإمام الحسين مستوفاة فلا وجه للتطويل في شرحها انتهى قالوا
0916IbnFanad.MaathirAbrar.Zaydiyya0000090BK1-ara1.completed, وقال لهم نتدبر ما في هذه الكتب لنعرف الذي خالفها منا ومنكم فقال مصنف سيرة الإمام أحمد بن سليمان عليه السلام فلم يسمعوا كلام القاضي
0916IbnFanad.MaathirAbrar.Zaydiyya0000090BK1-ara1.completed, ذكر محمد هذا فأقول إن مصنف سيرة الإمام وكذلك في الحدائق الوردية للفقيه العلامة حميد بن أحمد
0916IbnFanad.MaathirAbrar.Zaydiyya0000090BK1-ara1.completed, ذكر سيرة المهدي أحمد بن الحسين وأنه عارضه وناصبه وما آل إليه
0916IbnFanad.MaathirAbrar.Zaydiyya0000090BK1-ara1.completed, ذكر طرف من سيرة كل واحد حسبما اطلعت عليه وعلى ما رتبه السيد صارم
0916IbnFanad.MaathirAbrar.Zaydiyya0000090BK1-ara1.completed, قال مصنف سيرة المهدي وهو ولده وكانوا غير طامعين أن أحدا يجيبهم إلى
0916IbnFanad.MaathirAbrar.Zaydiyya0000090BK1-ara1.completed, قال مصنف السيرة العباسية وهذه منقبة مبتكرة من أجل المناقب لم يؤرخ مثلها
0916IbnFanad.MaathirAbrar.Zaydiyya0000090BK1-ara1.completed, يقول لك إنك إذا سرت في الناس السيرة الحسنة وسلكت بهم الطريق المستحسنة عتوا وتجبروا وخالفوا وتكبروا وامتنعوا
0920IbnKhalilZaynDinMalati.NaylAmal.Sham19Y0017097-ara1.completed, وذكر أنه سار سيرة العدل والتزمها في رعاياه وشكى ¬ من كثرة الاختلاف بينهم حتى
0920IbnKhalilZaynDinMalati.NaylAmal.Sham19Y0017097-ara1.completed, ذكر عنه أنه في عقله خلل أو نحو ذلك وأنه سيء السيرة وأنه يعرف بأبي بكر بن الرماح وخشب وبعث به إلى
0920IbnKhalilZaynDinMalati.NaylAmal.Sham19Y0017097-ara1.completed, ذكر الوالد ومدحه له ووصفه بالمعرفة والكتابة الجيدة وحسن السيرة وقال بأنه ولد فلان وأخته معي فأمره بإحضاره إلى بين
0920IbnKhalilZaynDinMalati.NaylAmal.Sham19Y0017097-ara1.completed, يذكر بحسن السيرة والعقل والسياسة من الله تعالى عليه بأن ملكه اليمن ودولة
0920IbnKhalilZaynDinMalati.NaylAmal.Sham19Y0017097-ara1.completed, يذكر بالخير وحسن السيرة ملك تلمسان مدة ثم قصده محمد بن أبي نائب وثار
0920IbnKhalilZaynDinMalati.NaylAmal.Sham19Y0017097-ara1.completed, وذكر وناب في القضاء وباشر بحسن سيرة مع الخير والدين والفقه وسمع على الزين الزركشي وغيره ومولده
0920IbnKhalilZaynDinMalati.NaylAmal.Sham19Y0017097-ara1.completed, يذكر بحسن تدبير وسياسة وحسن سيرة وشجاعة وفروسية بل عد من أبطال الإسلام عارفا بأنواع الآداب
0923AhmadQastallani.IrshadSari.Shamela0021715-ara1.mARkdown, قال والحاسب وهو من يعتمد منازل القمر وتقدير سيره في معنى المنجم وهو من يرى أن أول الشهر طلوع
0923AhmadQastallani.IrshadSari.Shamela0021715-ara1.mARkdown, ذكر إسلام سعيد بن زيد في ترجمته في أوائل السيرة النبوية ولعله كما قال في الفتح من تصرف الناقلين لكون
0923AhmadQastallani.IrshadSari.Shamela0021715-ara1.mARkdown, قال في الفتح لم أعرف اسم الرجل الذي طعنه ووقع في السيرة لابن إسحاق ما ظاهره أنه عامر بن الطفيل لأنه قال
0923AhmadQastallani.IrshadSari.Shamela0021715-ara1.mARkdown, وقال ابن إسحاق في السيرة النبوية التحنث بالمثلثة التبرر بالفوقية والموحدة والراءين أولاهما مضمومة مشددة
0923AhmadQastallani.IrshadSari.Shamela0021715-ara1.mARkdown, قال الهروي سبق وروينا أيضا من طريق الدولابي مما في سيرة ابن سعيد الناس عن يونس بن عبد الأعلى عن ابن
0923AhmadQastallani.MawahibLaduniyya.Shamela0023685-ara1, قال السهيلى حديث مرسل فى السيرة والمعروف فى الصحاح أن أبا بكر كان يصلى بصلاة رسول
0923AhmadQastallani.MawahibLaduniyya.Shamela0023685-ara1, قال فانهزمنا وركبوا أكتافنا وفى سيرة الدمياطى كان سيما الملائكة يوم حنين عمائم حمر أرخوها بين
0923AhmadQastallani.MawahibLaduniyya.Shamela0023685-ara1, ذكر قصته محمد بن إسحاق فى السيرة وأن أباه وعمه أتيا مكة فوجداه فطلبا أن يفدياه فخيره
0923AhmadQastallani.MawahibLaduniyya.Shamela0023685-ara1, وذكر المحب الطبرى فى مختصر السيرة النبوية له أنه صلى الله عليه وسلم ركب حمارا عريا
0923IbnCabdAllahKhazraji.KhulasatTadhhibTahdhibKamal.Shamela0005858BK1-ara1.completed, وقال لكنه من أثبت الناس في سيرة ابن إسحاق وقال أحمد ليس به بأس قال ابن عدي
0926ZakariyyaAnsari.AsnaMatalib.JK007113-ara1, قال والحاسب وهو من يعتمد منازل القمر وتقدير سيره في معنى المنجم وهو من يرى أن أول الشهر طلوع
0926ZakariyyaAnsari.GhurarBahiyya.Shamela0021848BK1-ara1, قال تعالى {إن أكرمكم عند الله أتقاكم} الحجرات والورع ما يزيد على العدالة بالعفة وحسن السيرة ذكره في الروضة وأصلها وهو لازم لقوله في المجموع والتحقيق
0926ZakariyyaAnsari.Munfarijatan.JK006951-ara1, يقول مخبرا عن حال سيره ومجاهدة نفسه بمراقبة ربه كأن رقيبا منك برعى خواطري وآخر
0927Culaymi.UnsJalil.Shamela0006626-ara1, ذكر ما وقع في الكعبة الشريفة من الهدم والبناء في السيرة الشريفة المحمدية وفي ذكر بناء عبد الملك بن مروان لمسجد
0927Nucaymi.DarisFiMadaris.JK000417-ara1.mARkdown, قال الشيخ بدر الدين الأسدي في كتابه الكواكب الدرية في السيرة النورية توفي رحمه الله تعالى يوم الأحد الحادي من شوال
0927Nucaymi.DarisFiMadaris.JK000417-ara1.mARkdown, قال أعني ابن الحاجب يشارك في علوم كثيرة وكان وكيلا لبيت المال بدمشق فلم يحسن السيرة ثم ولي قضاء القضاة بدمشق في شهر رجب سنة ثماني
0927Nucaymi.DarisFiMadaris.JK000417-ara1.mARkdown, قال الذهبي وكان إماما جليلا وافر الحرمة حسن السيرة مليح الصورة تام الشكل مهيأ وقال الشيخ تاج الدين اشتغل
0927Nucaymi.DarisFiMadaris.JK000417-ara1.mARkdown, وقال شيخنا بدر الدين بن قاضي شهبة في الكواكب الدرية في السيرة النورية في سنة ثلاث وأربعين وخمسماة نقلا عن ابن أبي
0927Nucaymi.DarisFiMadaris.JK000417-ara1.mARkdown, قال الذهبي وكان فقيها خيرا دينا محمود السيرة توفي ببغداد في شوال سنة أربع وستين وخمسمائة ومولده سنة
0927Nucaymi.DarisFiMadaris.JK000417-ara1.mARkdown, وقال شيخنا بدر الدين في كتابه الكواكب الدرية في السيرة النبوية في سنة اثنتين وثلاثين وخمسمائة وفيها أخذ عماد الدين
0927Nucaymi.DarisFiMadaris.JK000417-ara1.mARkdown, وقال شيخنا في الكواكب الدرية في السيرة النورية وقد كانت زوجته هذه أيضا من الصالحات الخيرات تكثر
0927Nucaymi.DarisFiMadaris.JK000417-ara1.mARkdown, وقال شيخنا بدرا دلين الأسدي في كتابه الكواكب الدرية في السيرة النورية وسار نور الدين الدين إلى حارم فملكها وغنم ما
0927Nucaymi.DarisFiMadaris.JK000417-ara1.mARkdown, قال شيخنا رحمه الله تعالى في الكواكب الدريه في السيره النوريه في سنة ثلاث واربعين وخمسمائه وفيها نزل الفرنج على
0927Nucaymi.DarisFiMadaris.JK000417-ara1.mARkdown, قال شيخنا بدر الدين بن قاضي شهبة في كتابه الكواكب الدرية في السيرة النورية قال في المرآة إلى ان قال فيها وفيها ما
0927Nucaymi.DarisFiMadaris.JK000417-ara1.mARkdown, وقال الصفدي رحمه الله تعالى وقف عليها بعض التجار بعض قرية وجمع سيرة لجده قل ان ترى العيون مثله توفي رحمه الله تعالى
0927Nucaymi.DarisFiMadaris.JK000417-ara1.mARkdown, وقال الموفق عبد اللطيف في سيرة العادل كان اصغر الاخوة واطولهم عمرا واعفهم ذكرا وانظرهم فب
0927Nucaymi.DarisFiMadaris.JK000417-ara1.mARkdown, وقال البدر الاسدي في كتابه الكواكب الدرية في السيرة النورية في سنة خمس وخمسين وخمسمائة وفيها استعفى القاضي زكي
0928AbuCabbasShammakhi.Siyar.ShamIbadiyya0000115-ara1.mARkdown, قال قد علمتم السيرة فنادى الصلاة جامعة فلما صلوا واجتمعوا وشاورهم على عادته قالوا
0928AbuCabbasShammakhi.Siyar.ShamIbadiyya0000115-ara1.mARkdown, قال أبو زكريا السمح عامل على حيز طرابلس فأحسن فيهم السيرة وعدل في حكمه فذلك حاله مقر بأمامة عبد الوهاب وناصحا
0928AbuCabbasShammakhi.Siyar.ShamIbadiyya0000115-ara1.mARkdown, قال أبو زكريا إن الإمام استعمل على قنطرارة أبا يونس وسيم وما ولاها فأحسن السيرة وسبب خروجه من جبل نفوسة إلى قنطرارة إن خدمه اذا
0928AbuCabbasShammakhi.Siyar.ShamIbadiyya0000115-ara1.mARkdown, قال له مجيبا لو رايت اجرافا يتلموا دينك وكانت اخته عالمة وحضرت وقعت مانو فاخذت اسيرة في عدة نساء فخافت عليهن الفساد من الفساق فامرت أن
0928AbuCabbasShammakhi.Siyar.ShamIbadiyya0000115-ara1.mARkdown, قال أبو العباس قرأ العلوم واتقنها واوضح المشكلات وبينها ورتب السيرة واحكمها وذكر أبو عمرو عن الشيخ أبي زكريا انه وجد
0928AbuCabbasShammakhi.Siyar.ShamIbadiyya0000115-ara1.mARkdown, قال أبو العباس فضله الله بالورع والسخا ولزوم السيرة وتساوى صلاح العلانية والسريرة واليد العليا في الكبيرة من الصلاة
0928MujirDinCulaymi.TarikhMuctabar.Sham19Y0127698-ara1.completed, وذكر في قبح سيرة يزيد وذمها ما اتفق في أيامه من قتل الحسين ابن
