file,search_result
1359AhmadShawqi.Shawqiyyat.Hindawi070706142-ara1, وقال الرشد أجمل سيرة يا أحمد ود الغواني من شبابك أبعد قد كان فيك
1359AminRihani.FaysalAwwal.Hindawi026848631-ara1, تذكر في سبيل حريته وأحسن شيئا من علم الاستقلال والتطبيق فينبغي أن يظل سائرا سيره هذا ولا بأس بمعاهدة بينه وبين الدولة التي كانت صاحبة
1359AminRihani.Nakabat.Hindawi050404926-ara1, يقول المؤرخ إن ابن طولون مثلا كان على جانب من العدل وحسن السيرة وإنه فكر كثيرا في عمران مملكته حتى زاد خراجها زاد
1359AminRihani.Rayhaniyyat.Hindawi081380829-ara1, ذكر شيء من سيرة نشوء هذا النابغة العظيم فإن فيها عبرة لمن اعتبر في
1359AminRihani.TarikhNajdHadith.Hindawi093039714-ara1, قال فيه عظمة السلطان إنه من العارفين المدققين هما مرجعي في النبذة الأولى أما السيرة فقد قصصت قصتها وقد أشفعت المصدر الأول الأعلى بما استوجبه
1359CabbasQummi.Kuna.Shia003764Vols-ara1.completed, يقول لأسيرن فيكم سيرة أمير المؤمنين ع لا اتبع موليا ولا أجهز على جريح
1359CabbasQummi.Kuna.Shia003764Vols-ara1.completed, وقال وسيرته سيرة فرعون بل كان فرعون أعدل منه في رعيته وأنصف منه
1359CabbasQummi.Kuna.Shia003764Vols-ara1.completed, قال لا حاجة لي في سلبه وكثير من اشعاره معروف ومشهور وفي كتب السيرة النبوية مسطور ومن شعره المتواتر عنه ما قاله يوم غدير
1359CabbasQummi.Kuna.Shia003764Vols-ara1.completed, ذكر سيرة المعتصم عن أحمد بن سليمان ابن أبي شيخ انه قدم
1359FarajAllahZakiKurdi.MajmucatFatawaIbnTaymiyya.Kraken220413194022-ara1, يذكر بعض المصنفين في السيرة من ان النبى صلى الله عليه وسلم آخى بين على
1359FarajAllahZakiKurdi.MajmucatFatawaIbnTaymiyya.Kraken220413194022-ara1, قال يقتلون أهل الاسلام ويدعون أهل الاوثان وهذا موجود في سيرة كثير من ملوك الاعاجم وغيرهم وكثير من أهل البدع وأهل
1359SulaymanBaruni.MukhtasarTarikhIbadiyya.ShamIbadiyya0000147-ara1, ذكر في سيره مئات من العلماء الأباضيين ونسائهم الشهيرات في العلم والصلاح وعشرات
1360IbnQasimMakhluf.ShajaratNur.Shamela9007669-ara1.completed, قال فيها إذا أصبت خيرا فحدث به إخوانك اه روح المعاني وفي السيرة الحلبية في باب عموم بعثته صلى الله عليه وسلم بعد
1361SacidIbnNasirGhaythi.IdahTawhid.ShamIbadiyya0000279-ara1, قال وأقام عبد الله بن يحيى بصنعاء شهرا يحسن السيرة في الناس ويلين جانبه لهم ويكف الأذى عنهم وكثر جمعه
1361SacidIbnNasirGhaythi.IdahTawhid.ShamIbadiyya0000279-ara1, قال لا أفعل ولا أخالف سيرة أسلافنا وأخذ جماعة منهم أسرا وأراد إطلاقهم فمنعه علي ابن
1361SacidIbnNasirGhaythi.IdahTawhid.ShamIbadiyya0000279-ara1, وقال إن لكل زمان سيرة وهؤلاء لم يؤسروا وهم هراب وإنما أسروا وهم يقاتلون ولو
1361SacidIbnNasirGhaythi.IdahTawhid.ShamIbadiyya0000279-ara1, ذكر ابن خلدون وابن الصغير المالكيان أن منهم الإمام عبد الله بن رستم وأنه سار سيرة جميلة ومن كلام ابن خلدون إنا للإباضية كارهون مبغضون إلا
1361SacidIbnNasirGhaythi.IdahTawhid.ShamIbadiyya0000279-ara1, قال في سيرة الشيخ أبي العباس رضي الله عنه ما نصه ومنهم جابر
1362CabdQadirIskandarani.MajallatHaqaiq.Sham19Y0029676-ara1, ذكر في جميع الأحوال لكان حسنا ونريد أن تنقل هنا نبذة ذكرها الحلبي في السيرة في مشروعية القيام عند ذكر وضعه صلى الله عليه وسلم
1362CabdQadirIskandarani.MajallatHaqaiq.Sham19Y0029676-ara1, قال الإمام النووي إذا روى الثقات الإثبات عنه أي عن سيرة الإباحة يوم فتح مكة والذي في حجة الوداع إنما هو
1362CabdQadirIskandarani.MajallatHaqaiq.Sham19Y0029676-ara1, قال ومن وجوه اختلاف أخبار تحريم المتعة ما وقع في روايات سيرة خاصة فإنها مختلفة اختلافا لا يصح معه التعويل عليها ففي
1362CabdQadirIskandarani.MajallatHaqaiq.Sham19Y0029676-ara1, ذكر العدل يتلون لك من عدل إنكلترا مثلا ما يظنونه غاية الغايات ولو سبروا سيرة الخلفاء الراشدين رضي الله عنهم وما كانوا عليه من العدل
1362CabdRahmanIbnDirham.NuzhatAbsar.ShamAY0005375-ara1, ذكر خبر ظهوره من الشام وأنه هاجر إلى الديار الأعجمية فأقام بها برهة محمود السيرة عاكفا على بث العلم ونشره وأطال ثم قال وهو اليوم
1363CabdRahmanBarquqi.Dhakhair.Sham19Y0036072-ara1, يقول للناس ثم يتمثل فلا تجزعن من سيرة أنت سرتها ووقع مرة في قصة رجل دعني من ذكر
1363CabdRahmanBarquqi.Firdaws.Hindawi016420804-ara1, ويقول له وهو أصدق القائلين وإنك لعلى خلق عظيم ولو أن المسلمين تدارسوا سيرة الرسول ووقفوا على شمائله الكريمة وأخذوا إخذه وحذوا حذوه واهتدوا
1363CabdRahmanBarquqi.MajallatBayan.Sham19Y0073348-ara1, وقال أما ترى كيف خدعتك هذه الأسرة فلتعلمن يا أخي أن للقوم سيرة عار وسمعة سوء وما من شاب في المدينة إلا ويحدثك
1363CabdRahmanBarquqi.MajallatBayan.Sham19Y0073348-ara1, ويذكر دائما حسناته التي ترفع من قدره ولا يحفظ من سيرة غيره إلا القبيح معتقدا أن الحط من قيمة رفعة له
1363CabdRahmanBarquqi.MajallatBayan.Sham19Y0073348-ara1, قال إن هذا الدين متين فأوغل فيه برفق إن المنبت الذي يجد في سيره حتى ينبت أخيرا سماه بما تؤول إليه عاقبته إن من
1363CabdRahmanBarquqi.MajallatBayan.Sham19Y0073348-ara1, ذكر خطوب شرين البطلة الفارسية المشهورة في حكايات الفرس كما أن يازجي أوغلو كتب السيرة النبوية الشريفة شعرا وسمى قصيدته المحمدية وأهم كتب منثور العصور
1363CumarTusun.MaliyatMisr.Hindawi025362624-ara1, قال جامع السيرة الناصرية وفي سنة خمس عشرة وسبعمائة م اختار السلطان الملك
1363CumarTusun.WadiNatrun.Hindawi024602682-ara1, ذكر في سيرة حياة هذا القديس أن عهده يعتبر أوج حياة الترهب في
1363CumarTusun.WadiNatrun.Hindawi024602682-ara1, وذكر في كتاب تاريخ البطاركة لمؤلفه افتس ص عند الكلام علي سيرة حياة داميانوس البطريرك الخامس والثلاثين عام م أنه بوشر في
1363CumarTusun.WadiNatrun.Hindawi024602682-ara1, ذكر في سيرة اسحق بطريرك الاسكندرية الواحد والاربعين عام م بالصفحة تأليف مينا
1363CumarTusun.WadiNatrun.Hindawi024602682-ara1, ذكر في كل مجموعة منها دير من الأديرة الأربعة السابقة التي ذكرت بدون أسماء في سيرة حياة البطريرك داميانوس وذكرت بأسمائها في مخطوط الفاتيكان المسطر بالقبطية
1363MahmudCakush.TarikhWaWasfJamicTuluni.Hindawi049202975-ara1, قال جامع السيرة الطولونية إن أحمد بن طولون بنى جامعه مما أفاء الله
1363MahmudCakush.TarikhWaWasfJamicTuluni.Hindawi049202975-ara1, ذكر جامع سيرة ابن طولون أن صاحب الزنج لما قدم البصرة في سنة
1364AhmadMuharram.DiwanMajdIslam.Hindawi027194802-ara1, وقال أهكذا يهن الزعيم ألا تقيم لياليا إنزل وسر في القوم سيرة ماجد لا تشمتن بك العدو ولا بيا نزل الزعيم يجر
1364CamirIbnKHamisMaliki.GhayatMatlub.ShamIbadiyya0000459-ara1, قال من توضأ يوم الجمعة فيها ونعمت ومن اغتسل فذلك أفضل وأفضل ومن سيرة محبوب بن الرحيل رحمه الله إلى أهل خضرموت في أمر
1365AhmadCisa.TarikhBimaristanatFiIslam.Hindawi018197281-ara1, وقال ابن إسحاق في السيرة كان رسول الله صلى الله عليه وسلم قد جعل سعد
1365AhmadCisa.TarikhBimaristanatFiIslam.Hindawi018197281-ara1, وقال جامع السيرة الطولونية وفي سنة ه بنى أحمد بن طولون المارستان ولم
1366AnastasKarmali.KhulasatTarikhCiraq.Hindawi046069628-ara1, وقال الصولي كان أهوج سفاكا للدماء قبيح السيرة كثير التلون والاستحالة مدمن الخمر ولولا جودة حاجبه سلامة لأهلك
1366AnastasKarmali.KhulasatTarikhCiraq.Hindawi046069628-ara1, وقال ابن واصل كان الخليفة مع ذلك رديء السيرة في الرعية مائلا إلى الظلم والعسف ففارق أهل البلاد بلادهم
1366AnastasKarmali.MajallatLughatCarab.Sham19Y0036540-ara1, يقول تخذوا الخلافة سيرة لوساوس ولكل وهم عابث ومعاند وفي ص حول الدين والعلم
1366AnastasKarmali.MajallatLughatCarab.Sham19Y0036540-ara1, قال وشأن ملكهم هذا عجيب في حسن السيرة واستعمال المسلمين واتخاذ الفتيان المجابيب مجاذيب ومجذوب في اصطلاح الصوفية
1366AnastasKarmali.MajallatLughatCarab.Sham19Y0036540-ara1, ذكر أصحابها سيرة الأبطال المشار إليهم ثم أن هذه الكتب لا تذكر سيرتهم
1366AnastasKarmali.MajallatLughatCarab.Sham19Y0036540-ara1, قال قبيل الوفاة نابي بحضور أمد فصار تاريخا لوفاته وله هذه السيرة المعروفة بذيل سيرنابي أو سيرحبيب اكرم ذيل مرتضى أفندي وهذا
1366AnastasKarmali.MajallatLughatCarab.Sham19Y0036540-ara1, ذكر هذا وقال أنني واقف على سيرة هذا الوزير حسن باشا وعالم بها كما هي حقها وهذه
1366AnastasKarmali.MajallatLughatCarab.Sham19Y0036540-ara1, يقول انقسام دجلة إلى قسمين ويحكي لنا سيره في أحدهما وهو الشرقي ثم ينوه بأنه وجد على هذا
1366AnastasKarmali.MajallatLughatCarab.Sham19Y0036540-ara1, قال أبو محمد عبد الملك بن هشام في أوائل سيرة رسول الله ص أول من سن الرحلتين لقريش رحلة الشتاء
1366AnastasKarmali.MajallatLughatCarab.Sham19Y0036540-ara1, وذكر أولياءها ووقائع القطر التاريخية الاخرى واكمل سيرة الرسول ص وقد بينت جميع مؤلفاته وهي تثبت ما نفاه
1366MustafaCabdRazzaq.BahaZuhayr.Hindawi062929363-ara1, ذكر في كتاب الأدفوي إلا عرضا ولم يحدثنا أحد ممن ترجموا للبهاء زهير عن سيرة أبيه غير أنا وجدنا في نسخة خطية قديمة بدار الكتب
1366MustafaCabdRazzaq.FaylasufCarabWaMucallimThani.Hindawi061571979-ara1, قال ولا الكندي فإن الكندي على غزارته وجودة استنباطه رديء اللفظ قليل الحلاوة متوسط السيرة كثير الغارة على حكمة الفلاسفة وثابت ألزم للقطب وأشد اعتسافا
1367AhmadMutac.TarikhYamanIslami.Rafed0002171-ara1.completed, قال السيد العباس مؤلف السيرة ووصل خبر الدعام انه لما صار إلى بلده أمر بالأذان
1367AhmadMutac.TarikhYamanIslami.Rafed0002171-ara1.completed, وقال في تتمة سيرة الإمام الهادي انه لما تضايقوا بالحصار كاتبوا الحرملي صاحب زبيد
1367AhmadMutac.TarikhYamanIslami.Rafed0002171-ara1.completed, وذكر وقعة نغاش في حوادث سنة وقد مر بك ما نقلناه عن اللآلىء المضيئة وفي سيرة الإمام الناصر ان انصراف جند الناصر من محاصرة مسور سنة
1367AhmadMutac.TarikhYamanIslami.Rafed0002171-ara1.completed, قال في سيرة الامام المنصور لما بلغ الإمام إلتياث الأحوال على ولاته باليمن
1367AhmadMutac.TarikhYamanIslami.Rafed0002171-ara1.completed, قال في سيرة الأمير ذي الشرفين ما خلاصته انه لما قتل الصليحي في
1367AhmadMutac.TarikhYamanIslami.Rafed0002171-ara1.completed, قال في سيرة ذي الشرفين وكان جبل شهارة يسمى معتقا وفيه يقول وإذا
1367AhmadMutac.TarikhYamanIslami.Rafed0002171-ara1.completed, قال كاتب سيرة ذي الشرفين في بيان السبب الباعث لهذه الانقلابات وهذه التصورات
1367AhmadMutac.TarikhYamanIslami.Rafed0002171-ara1.completed, قال كاتب سيرة الامام المتوكل انه لم يبن في اليمن مثله وإلى حادثة
1367AhmadMutac.TarikhYamanIslami.Rafed0002171-ara1.completed, قال في سيرة الإمام ما خلاصته أنه لما وصل إلى اشيح اقام به
1367AhmadMutac.TarikhYamanIslami.Rafed0002171-ara1.completed, ذكر هذه المرثاة ومرثاة الإمام كاتب السيرة وفيها أعاد الإمام الكرة على أهل صعدة وسار لحربهم في
1367AhmadMutac.TarikhYamanIslami.Rafed0002171-ara1.completed, قال كاتب سيرة الإمام احمد بن سليمان وعنه نقلنا هذه الأخبار وبقتل هؤلاء
1368HasanAmin.MustadrakatAcyanShica.Shia003634Vols-ara1, يقول هذا الفريق ي أن يسير معهم سيرة جده مع أهل الشام وكان بقاؤه في الكوفة وهي علوية
1368HasanAmin.MustadrakatAcyanShica.Shia003634Vols-ara1,‍ وقال ابن الفوطي ولي الاعمال الجليلة وسار فيها السيرة الجميلة فتى من أهل الكوفة أخذ علي عليه السلام مصحفا
1368HasanAmin.MustadrakatAcyanShica.Shia003634Vols-ara1, يذكر وفضائله أظهر من أن تسطر وابن سينا من الفلاسفة القلائل الذين دونوا سيرة حياتهم وكتبوا أخبارهم ويعود الفضل إلى أحد تلامذته المعروف بأبي
1368HasanAmin.MustadrakatAcyanShica.Shia003634Vols-ara1, يذكر في سيرة سعد صالح أنه عند ما كان متصرفا في لواء المنتفك
1368HasanAmin.MustadrakatAcyanShica.Shia003634Vols-ara1, وذكر مدينة قزوين نشير هنا إلى ما ورد في سيرة المترجم في كتاب موسوعة البرغاني الفقهية عن الخلاف بين الأخباريين
1368HasanAmin.MustadrakatAcyanShica.Shia003634Vols-ara1, ذكر في السيرة المؤيدية أنه كان يعقد مجلسا خاصا كل يوم خميس يقرأ
1368IbrahimCabdQadirMazini.CaMashi.Hindawi030603192-ara1, قال ولم لا يوم واحد يكفي ما دمنا قد سألنا ووثقنا أنه شاب طيب حسن السيرة قال وهل سألت يا عمي ووثقت فقال الرجل بلهجة المتأفف
1368ShakibArslan.HulalSundusiyya.Hindawi020790318Vols-ara1, قال ابن الأبار وسمع من أبي الحسن طارق بن يعيش كتاب السيرة لابن إسحاق ولكن لم يجز له وأخذ عن أبي بكر
1368ShakibArslan.HulalSundusiyya.Hindawi020790318Vols-ara1, يذكر المؤلف أن ابن عياض بعد أن استنقذ مرسية سار فيها سيرة حسنة امتد بها عليها رواق الأمن ورأب من أحوالها ولا
1368ShakibArslan.ShawqiSadaqatArbacinSana.Hindawi096809026-ara1, قال القاضي بهاء الدين بن شداد صاحب سيرة صلاح الدين المسماة بالمحاسن اليوسفية وكان ملازما للسلطان يقيد كل
1368ShakibArslan.ShawqiSadaqatArbacinSana.Hindawi096809026-ara1, يقول يا شباب الشرق عنوان الشباب ثمرات الحسب الزاكي النمير حسبكم في الكرم المحض اللباب سيرة تبقى بقاء ابني سمير في كتاب الفخر للداخل باب لم
1369FarajSulaymanFuad.ShuhadaCilmWaGhurba.Hindawi071316295-ara1, ذكر هذه السيرة الشريفة مولد الأمير ولد الأمير عمر بن طوسون بن سعيد
1369MuhammadRida.Muhammad.Shamela0012935-ara1, قال مما هو مذكور في هذا الكتاب نقلا عن سيرة ابن هشام كانت العرب تسمع من أهل الكتاب ومن الكهان
1369MuhammadRida.Muhammad.Shamela0012935-ara1, ذكر هذه الغزوة الواقدي وذكرها السيد دحلان في الجزء الثاني من كتاب السيرة النبوية وأني أشك في تفاصيل القصة بهذه الصفة أشك في
1369MuhammadRida.Muhammad.Shamela0012935-ara1, قال الحلبي في السيرة وفي ذلك المحل بنى مسجد يقال له مسجد الراية ودخل
1370MuhammadRaghibTabbakh.IclamNubala.Rafed0002341Vols-ara1.completed, قال في الكشف في صحيفة / عقود الجواهر في سيرة الملك الظاهر بيبرس التركي لابن أبي طي يحيى بن حميدة
1370MuhammadRaghibTabbakh.IclamNubala.Rafed0002341Vols-ara1.completed, قال الطرشوشي في كتابه سراج الملوك في باب سيرة السلطان قال رجاء ابن حيوه بينا نحن بخناصرة إذا بامرأة
1370MuhammadRaghibTabbakh.IclamNubala.Rafed0002341Vols-ara1.completed, قال ابن الأثير في هذه السنة سار المأمون إلى الروم في المحرم وكان سيره عن طريق الموصل حتى صار إلى منبج ثم إلى دابق
1370MuhammadRaghibTabbakh.IclamNubala.Rafed0002341Vols-ara1.completed, قال ابن الأثير في هذه السنة عزل بكجور عن دمشق وسبب ذلك أنه أساء السيرة في دمشق فجهز العزيز بالله إليه العساكر من مصر مع
1370MuhammadRaghibTabbakh.IclamNubala.Rafed0002341Vols-ara1.completed, قال ابن الأثير في هذه السنة كانت وقعة بين عسكر المصريين وبين الروم سيره الدزبري فظفر المسلمون وكان سبب ذلك أن ملك الروم قد
1370MuhammadRaghibTabbakh.IclamNubala.Rafed0002341Vols-ara1.completed, قال ابن الأثير في هذه السنة في المحرم قتل يوسف بن آبق الذي ذكرنا أنه سيره تاج الدولة تتش إلى بغداد ونهب سوادها وكان سبب قتله
1370MuhammadRaghibTabbakh.IclamNubala.Rafed0002341Vols-ara1.completed, قال في الروضتين نقلا عن يحيى بن أبي طي في كتاب السيرة الصلاحية ومن أعجب ما حكي أنه لما اشتد حصار قلعة
1370MuhammadRaghibTabbakh.IclamNubala.Rafed0002341Vols-ara1.completed, قال في الروضتين فصل في بعض سيرة الشهيد أتابك زنكي وكانت من أحسن سير الملوك وكانت رعيته
1370MuhammadRaghibTabbakh.IclamNubala.Rafed0002341Vols-ara1.completed, وقال ابن شداد في سيرة صلاح الدين إن أسد الدين كان كثير الأكل شديد المواظبة
1370MuhammadRaghibTabbakh.IclamNubala.Rafed0002341Vols-ara1.completed, قال في الروضتين وفي السيرة الصلاحية وفي المختار من الكواكب المضية لما مات نور الدين
1370MuhammadRaghibTabbakh.IclamNubala.Rafed0002341Vols-ara1.completed, وقال القاضي ابن شداد في السيرة الصلاحية لما تحقق السلطان صلاح الدين وفاة نور الدين وكان
1370MuhammadRaghibTabbakh.IclamNubala.Rafed0002341Vols-ara1.completed, قال ابن شداد في السيرة الصلاحية لما وقعت الوقعة الأولى مع الحلبيين والمواصلة كان سيف
1370MuhammadRaghibTabbakh.IclamNubala.Rafed0002341Vols-ara1.completed, وقال القاضي ابن شداد في السيرة الصلاحية نزل السلطان على حلب في ثامن عشر جمادى الأولى
1370MuhammadRaghibTabbakh.IclamNubala.Rafed0002341Vols-ara1.completed, قال القاضي ابن شداد في السيرة الصلاحية في شهر جمادى الآخرة وصل رسول الخليفة ومعه الخلع
1370MuhammadRaghibTabbakh.IclamNubala.Rafed0002341Vols-ara1.completed, قال القاضي في السيرة الصلاحية المسماة بالنوادر اليوسفية في فصل نزول السلطان على كوكب
1370MuhammadRaghibTabbakh.IclamNubala.Rafed0002341Vols-ara1.completed, وذكر القاضي ابن شداد في السيرة الصلاحية تفاصيل ذلك ثم قال وكانت وفاته بدمشق بعد صلاة
1370MuhammadRaghibTabbakh.IclamNubala.Rafed0002341Vols-ara1.completed, وقال القاضي ابن شداد في القسم الأول من كتابه السيرة الصلاحية الذي ذكر فيه مولده ومنشأه وخصائصه وأوصافه وأخلاقه المرضية
1370MuhammadRaghibTabbakh.IclamNubala.Rafed0002341Vols-ara1.completed, قال في الروضتين وكان خيرا عادلا حسن السيرة جوادا محافظا على حسن العهد وأداء الأمانة قليل العذر بل
1370MuhammadRaghibTabbakh.IclamNubala.Rafed0002341Vols-ara1.completed, قال القطب اليونيني في تاريخه ذيل مرآة الزمان قد أشرنا إلى سوء سيرة الملك السعيد مع الجند والرعية فأجمع رأي الأمراء بحلب على
1370MuhammadRaghibTabbakh.IclamNubala.Rafed0002341Vols-ara1.completed, قال وقد جمع له كاتبه ابن عبد الظاهر سيرة مطولة وكذلك ابن شداد الحلبي أيضا وذكر ثمة آثاره في
1370MuhammadRaghibTabbakh.IclamNubala.Rafed0002341Vols-ara1.completed, قال في كتاب السلوك بعد ذكر خبر وفاته وكان مشكور السيرة قال في السلوك في حوادث هذه السنة وقدم البريد بأن
1370MuhammadRaghibTabbakh.IclamNubala.Rafed0002341Vols-ara1.completed, قال ولإفراط نكايتهم في الروم صنفت السيرة المعروفة بدلهمة والبطال منسوبة إليهم بما فيها من ملح الحديث
1370MuhammadRaghibTabbakh.IclamNubala.Rafed0002341Vols-ara1.completed, قال وكان مشهورا بالشجاعة مشكور السيرة إلا أنه لم يسعده جده قال أبو ذر دخل إينال
1370MuhammadRaghibTabbakh.IclamNubala.Rafed0002341Vols-ara1.completed, يذكر وقت وفاته اه وقال يعني ابن أبي طي في سيرة الملك الظاهر في السنة التي قتل فيها السهروردي هي سنة
1370MuhammadRaghibTabbakh.IclamNubala.Rafed0002341Vols-ara1.completed, وقال ابن أبي طي في سيرة الظاهر في هذه السنة أي سنة ثمان وستمائة تمت الحمام
1370MuhammadRaghibTabbakh.IclamNubala.Rafed0002341Vols-ara1.completed, قال ابن شداد في سيرة السلطان ورأيته يعني السلطان وهو يأخذها عليهم وهم يقرؤونها بين
1370MuhammadRaghibTabbakh.IclamNubala.Rafed0002341Vols-ara1.completed, وقال القاضي بهاء الدين المعروف بابن شداد قاضي حلب في أوائل سيرة صلاح الدين وكان رحمه الله عليه كثير التعظيم لشعائر الدين
1370MuhammadRaghibTabbakh.IclamNubala.Rafed0002341Vols-ara1.completed, وقال ابن رافع في معجمه سمع من الأبرقوهي السيرة وسمع من جده وعم أبيه وحدث أحمد بن أبي طالب
1370MuhammadRaghibTabbakh.IclamNubala.Rafed0002341Vols-ara1.completed, وقال كان مشكور السيرة فاضلا أتقن الشروط ورأس فيها ا ه داود بن علي
1370MuhammadRaghibTabbakh.IclamNubala.Rafed0002341Vols-ara1.completed, قال ابن خطيب الناصرية إنه قرأ عليه السيرة والدر المذكورين وإنه كان فاضلا كثير الاشتغال والإشغال مجتهدا في
1370MuhammadRaghibTabbakh.IclamNubala.Rafed0002341Vols-ara1.completed, قال العلاء بن خطيب الناصرية وكان حسن السيرة دينا عاقلا ولي القضاء ثم صرف ثم أعيد مرارا ثم
